description,review_majority,food_aspect_majority,ambiance_aspect_majority,service_aspect_majority,noise_aspect_majority,cleanliness,price,location,menu variety,waiting time,waiting area,parking,wi-fi,kids-friendly
Overbooked but honored our reservations and we didnt have to go on wait list with walk INS.,no majority,unknown,unknown,Positive,unknown,unknown,unknown,unknown,unknown,Positive,unknown,unknown,unknown,unknown
"I was really impressed with the meal. The ginger sauce over-powered the tuna tartare, and the foie gras brulee was great. The waiter also was not very helpful with selecting the wine.",no majority,Positive,unknown,Negative,unknown,unknown,unknown,unknown,unknown,unknown,unknown,unknown,unknown,unknown
Good food but service needs some tweaking. Good drink deals and appetizer deals. Quiet and intimate.,4,Positive,unknown,Negative,Positive,unknown,unknown,unknown,unknown,unknown,unknown,unknown,unknown,unknown
"There are better places to eat in he North End, like Marco and it is way too loud in here too.",2,Negative,no majority,unknown,Negative,unknown,unknown,unknown,unknown,unknown,unknown,unknown,unknown,unknown
I was not pleased. This venue does not accept AMERICAN EXPRESS GIFT CHEQUES!!! That is rediculous. This medium is the same as CASH. At least the server was nice,2,unknown,unknown,Positive,unknown,unknown,unknown,unknown,unknown,unknown,unknown,unknown,unknown,unknown
"We went for a nice lunch. It was way to expensive for the food we received and the portion size. The food was bad and nothing special. Also, the menu was too limited. $21 for a chicken leg? Come on.",1,Negative,unknown,unknown,unknown,unknown,Negative,unknown,Negative,unknown,unknown,unknown,unknown,unknown
"We loved our lunch at Chops. The food selection and presentation was wonderful, but our waiter was rude.",4,Positive,unknown,Negative,unknown,unknown,unknown,unknown,Positive,unknown,unknown,unknown,unknown,unknown
The quality of the food and the service is always inconsistent.,no majority,Positive,unknown,Positive,unknown,unknown,unknown,unknown,unknown,unknown,unknown,unknown,unknown,unknown
We go here often.  At a higher level than most high end restaurants.,4,unknown,unknown,unknown,unknown,unknown,unknown,Positive,Positive,unknown,Positive,unknown,unknown,unknown
"Food was overpriced and bland,while the waiter was robot like and unfriendly. Place had a creepy vibe and smelled musty.",1,Negative,Negative,Negative,unknown,unknown,Negative,unknown,unknown,unknown,unknown,unknown,unknown,unknown
The servings were minuscule for the outrageus price. The service was ok. We are not planning to come back anytime soon.,2,Negative,unknown,no majority,unknown,unknown,Negative,unknown,unknown,unknown,unknown,unknown,unknown,unknown
Disappointing. Food was fair at best and seem to lack seasoning or something to bring out the flavor.,2,Negative,unknown,unknown,unknown,unknown,unknown,unknown,unknown,unknown,unknown,unknown,unknown,unknown
not italian at all this is a restaurant that hides under the italian name.The pizza was kind of mexican the spaghetti overcooked and the service rude,1,Negative,unknown,Negative,unknown,unknown,unknown,unknown,unknown,unknown,unknown,unknown,unknown,unknown
No host to welcome us. Every loud with DJ music. Dj make it a turn off for dinning. Very unorganized with staff and order.,1,unknown,Negative,Negative,Negative,unknown,unknown,unknown,unknown,unknown,unknown,unknown,unknown,unknown
We are regulars and I was a bit dissapointed with the service.. We had an 8 p.m. curtain to make and while we did I had to get up to go pay the bill. Gave a short tip.,no majority,unknown,unknown,Negative,unknown,unknown,unknown,unknown,unknown,unknown,unknown,unknown,unknown,unknown
"It was good. I asked for steamed lobster and received backed stuffed. But it was still good (I don't like to send things back). Our waiter was DREADFUL!
Thank you!
V Hall",no majority,Positive,unknown,Negative,unknown,unknown,unknown,unknown,unknown,unknown,unknown,unknown,unknown,unknown
Great all around service.,4,Positive,Negative,Positive,unknown,Positive,unknown,unknown,unknown,unknown,Positive,unknown,unknown,unknown
"We didn't get seated for an hour after our booking time...No bar seating so stood around for an hour. People that came after us were seated before. Hard to like it after that! Despite this, it was still a comfortable volume for our meal.",no majority,unknown,unknown,Negative,Positive,unknown,unknown,Negative,unknown,Negative,Negative,unknown,unknown,unknown
"Our server was excellent. She could benefit with some professional training, however she had natural ability to please her customer!!! Loved her. the ambiance was great, a very chill environment.",no majority,unknown,Positive,Positive,unknown,unknown,unknown,Positive,unknown,unknown,unknown,unknown,unknown,unknown
Excellent fresh seafood with imaginative pairings. Music was quite pleasant too.,5,Positive,unknown,unknown,Positive,unknown,unknown,unknown,Positive,unknown,unknown,unknown,unknown,unknown
"I ordered steak with frites. The steak was good and  so were the fries, although not the typical French style. My starter salad was just solid.",4,Positive,unknown,unknown,unknown,unknown,unknown,unknown,unknown,unknown,unknown,unknown,unknown,unknown
"Bad food, but great for a crowd. Staff works hard to keep it under control.",3,Negative,unknown,Positive,Positive,unknown,unknown,unknown,unknown,unknown,unknown,unknown,unknown,unknown
The service was not very good.I don't think we will be going back.,2,unknown,unknown,Negative,unknown,unknown,unknown,unknown,unknown,unknown,unknown,unknown,unknown,unknown
"Bouchon at the Venetian was a great time out in Vegas. Nice food, service.  Will definitely check out more of Keller's spots in California after a successful dinenr in Vegas.",5,Positive,unknown,Positive,unknown,unknown,unknown,Positive,Positive,unknown,Positive,unknown,unknown,unknown
Won't be going back.,1,Negative,unknown,unknown,unknown,unknown,unknown,unknown,Negative,Negative,Negative,unknown,unknown,unknown
"The service and food were excellent. It was just the right level of noise, to be able to have a conversation.",no majority,Positive,unknown,Positive,Negative,unknown,unknown,unknown,unknown,unknown,unknown,unknown,unknown,unknown
Disappointed in the food...outrageous prices for the quality of the meal and the ambiance was lacking.,1,Negative,Negative,unknown,unknown,unknown,Negative,unknown,unknown,unknown,unknown,unknown,unknown,unknown
Disappointing.,2,unknown,unknown,unknown,unknown,unknown,unknown,unknown,Negative,Negative,unknown,unknown,unknown,unknown
I had the lasagne and it was probably the worst lasagne I've ever had. I was very disappointed in the food. My waitress never offered me a drink refill. I'm not sure if I'll return to eat at Il Fornaio.,1,Negative,unknown,Negative,unknown,unknown,unknown,unknown,unknown,unknown,unknown,unknown,unknown,unknown
None of us cared for the new menu. Service was fast. Noise level too high. They dropped the half-price bottles of wine. We will not be back for a while.,2,Negative,unknown,Positive,Negative,unknown,unknown,unknown,unknown,Positive,unknown,unknown,unknown,unknown
Food was so so. Service was slow. At least the restaurant was quiet.,2,Negative,unknown,Negative,Positive,unknown,unknown,unknown,unknown,Negative,unknown,unknown,unknown,unknown
"We were there for Easter...a typically very busy day.....it was busy, and Amanda handled it poorly.",no majority,unknown,unknown,Negative,unknown,unknown,unknown,unknown,unknown,unknown,unknown,unknown,unknown,unknown
I have been to Maggiano's several times.,3,unknown,unknown,unknown,unknown,unknown,unknown,Positive,Positive,unknown,Positive,unknown,unknown,Positive
The salmon was too dry. The service was poor too.,2,Negative,unknown,Negative,unknown,unknown,unknown,unknown,unknown,unknown,unknown,unknown,unknown,unknown
service very slow. Lobster special not very good,no majority,Negative,unknown,Negative,unknown,unknown,unknown,unknown,unknown,Negative,unknown,unknown,unknown,unknown
The Menu is too narrow. We had a large table and our waiter had way too many tables to service properly and all the tables were packed together in a small space.,2,unknown,Negative,Negative,unknown,unknown,unknown,unknown,unknown,unknown,unknown,unknown,unknown,unknown
This restaurant was INCREDIBLY loud. The food was very good but we literally could not speak to each other. Service was pleasant among that. Don't ruin your night.,2,Positive,Negative,Positive,Negative,unknown,unknown,Negative,unknown,unknown,unknown,unknown,unknown,unknown
The restaurant was nice & the waiter was really good. The food was not very good for the price. The valet service was HORRIBLE & RUDE!! It was too loud to even think. We won't be returning.,2,Negative,Positive,Negative,Negative,unknown,Negative,unknown,unknown,unknown,unknown,unknown,unknown,unknown
"My husband and I met a couple of friends for dinner, and had a wonderful evening. We will be dining there again, the atmosphere was the only downside.",4,unknown,Negative,unknown,unknown,unknown,unknown,unknown,unknown,unknown,unknown,unknown,unknown,unknown
We went to the chocolate bar and it was so overpriced for what it was. The desserts were nothing special. Service was inattentive. It was though they were purchased at BJ's or Costco wholesale clubs.,2,Negative,unknown,Negative,unknown,unknown,Negative,unknown,unknown,unknown,unknown,unknown,unknown,unknown
I wasn't impressed by the food relative to the price. There are definitely many other restaurants in Little Italy I would have rather eaten at,3,Negative,unknown,unknown,unknown,unknown,Negative,unknown,unknown,unknown,unknown,unknown,unknown,unknown
Very nicely priced for the size of each entree. Food was very good.,5,Positive,unknown,unknown,unknown,unknown,Positive,unknown,unknown,unknown,unknown,unknown,unknown,unknown
The only downside to this restaurant is that I wanted to try everything on the menu. The food was delicious but the staff wasn't friendly and helpful. I will definitely go again (and again).,no majority,Positive,unknown,Negative,unknown,unknown,unknown,unknown,Positive,unknown,unknown,unknown,unknown,unknown
Very crowded and loud.,1,unknown,Negative,unknown,Negative,unknown,unknown,Negative,unknown,unknown,Negative,unknown,unknown,unknown
"The opposite of sister restaurant Molyvos, food was bland and ordinary, portions large and leaden, and sauces gloppy. The only thing decent was the service, but still would not go back even if weren't also so expensive.",no majority,Negative,unknown,Positive,unknown,unknown,Negative,unknown,unknown,unknown,unknown,unknown,unknown,unknown
"Terrible ambiance, good food and service. Will recommend it to others.",3,Positive,Negative,Positive,unknown,unknown,unknown,unknown,unknown,unknown,unknown,unknown,unknown,unknown
I have been here before and either they had an off night or their Restaurant Week offering is just of a lower quality.,2,Negative,unknown,unknown,unknown,unknown,unknown,unknown,unknown,unknown,unknown,unknown,unknown,unknown
"Very disappointing. Tough veal scallopini, blah lobster ravioli filling. Friendly service. Nice, attractive space -- but food quality is most important to me.",2,Negative,Positive,Positive,unknown,unknown,unknown,unknown,unknown,unknown,unknown,unknown,unknown,unknown
"Mediocre. service was so so, hectic environment, seating is too close to other tables. Food was okay. Don't think I'll go back.",2,no majority,Negative,Negative,Negative,unknown,unknown,unknown,unknown,unknown,unknown,unknown,unknown,unknown
This place has non-existent service but is next door to the AAC for Mavs games and that is the ONLY reason to eat here.,2,Negative,Negative,Negative,unknown,unknown,unknown,Positive,unknown,unknown,unknown,unknown,unknown,unknown
Pretentious service.,no majority,unknown,unknown,Negative,unknown,unknown,unknown,unknown,unknown,unknown,unknown,unknown,unknown,unknown
"I was overjoyed with the food. Also, we were seated in the side room by the kitchen and not the main dining room; the ambiance is lacking in that room.",4,Positive,Negative,unknown,unknown,unknown,unknown,unknown,unknown,unknown,unknown,unknown,unknown,unknown
"The food was unremarkable, the service okay but not great, and the ambiance unpleasant. Staff seemed stressed and were not particularly pleasant.",2,Negative,Negative,Negative,unknown,unknown,unknown,unknown,unknown,unknown,unknown,unknown,unknown,unknown
Food and service were good. was tripple billed on my credit card. When called back to inquire the female was rude and not forthcoming.... would not recommend to anyone due to this problem!!!!! Adding to that the noise was an uncomfortable level.,2,Positive,unknown,Positive,Negative,unknown,unknown,unknown,unknown,unknown,unknown,unknown,unknown,unknown
Entrees were very bad. We tried 3 different ones. Plus the place was too dark and cold.,no majority,Negative,Negative,unknown,unknown,unknown,unknown,unknown,unknown,unknown,unknown,unknown,unknown,unknown
"Food was very good, out door garden was very nice. I had asked for something to be added to my entree and the chef gladly accommodated this request. Service was great.",no majority,Positive,Positive,Positive,unknown,unknown,unknown,Positive,unknown,unknown,unknown,unknown,unknown,unknown
way overpriced considering seafood was just ok--should have been outstanding at these prices. Service was the best I've had in awhile.,3,Negative,unknown,Positive,unknown,unknown,Negative,unknown,unknown,unknown,unknown,unknown,unknown,unknown
"Great food, but bad service and the high level of noise from the bar area made it nearly impossible to hold a conversation at our table.

This isn't a dining experience that we will be repeating.",no majority,Positive,Negative,Negative,Negative,unknown,unknown,Negative,unknown,unknown,unknown,unknown,unknown,unknown
Very expensive wine list. Food just so so. Extremely noisy but the service was good. I would not return.,2,Negative,Negative,Positive,Negative,unknown,Negative,unknown,unknown,unknown,unknown,unknown,unknown,unknown
"The food and service were excellent.
The Chef is shy but obviously cares about the food and its preparation. The ambiance was not that good",3,Positive,Negative,Positive,unknown,unknown,unknown,unknown,unknown,unknown,unknown,unknown,unknown,unknown
service was very poor. we kept asking each other if we had a waiter. food was terrific. noise level was one of the highest,no majority,Positive,unknown,Negative,Negative,unknown,unknown,unknown,unknown,Negative,unknown,unknown,unknown,unknown
The waitress acted like she would have rather been having a root canal. We won't go back.,1,unknown,unknown,Negative,unknown,unknown,unknown,unknown,unknown,unknown,unknown,unknown,unknown,unknown
"the food is fabulous.
I like that you keep the menu changing.",5,Positive,unknown,unknown,unknown,unknown,unknown,unknown,Positive,unknown,unknown,unknown,unknown,unknown
"we love the restaurant and everything about it.
excellent food and ambience...and an up atmosphere.",5,Positive,Positive,unknown,no majority,unknown,unknown,Positive,Positive,unknown,Positive,unknown,unknown,unknown
Overpriced and not a restaurant that we would frequent again.,no majority,unknown,unknown,unknown,unknown,unknown,Negative,Negative,unknown,unknown,unknown,unknown,unknown,unknown
"This was our first time at this restaurant and we were very happy with our experience and service, and will definitely be returning!",no majority,unknown,Positive,Positive,unknown,unknown,unknown,Positive,unknown,unknown,unknown,unknown,unknown,unknown
Waiter was very rude but was replaced after complaining to the manager who was extremely very nice and curteous to me and wife. The noise level was acceptable. We felt we could speak freely without nearby tables hearing.,4,unknown,unknown,Negative,Positive,unknown,unknown,unknown,unknown,unknown,unknown,unknown,unknown,unknown
"rushed, on a deserted weeknight, food made up for the service a bit. Stodgy, OLD! Not going back soon.",no majority,Positive,Negative,Negative,unknown,unknown,unknown,unknown,unknown,Negative,unknown,unknown,unknown,unknown
"The food was great,its very relaxing. It was overall good.",4,Positive,unknown,unknown,unknown,unknown,unknown,unknown,unknown,unknown,unknown,unknown,unknown,unknown
"The mussels were very good but all of the entrees were not very good and served cold. Plus, it was so obnoxiously loud inside.",2,Negative,unknown,unknown,Negative,unknown,unknown,unknown,unknown,unknown,unknown,unknown,unknown,unknown
"Won't be returning. When you go to a restaurant/bar and they don't even have popular scotches such as Dewars and Glenlivet, why bother coming? Love the service as they were very attentive",no majority,Negative,unknown,Positive,unknown,unknown,unknown,unknown,Negative,unknown,unknown,unknown,unknown,unknown
"Gr8 venue, terrible service, shuttle service to the theatre.
The food is simply not worth the price tag, which was reasonable in itself.",no majority,Negative,Positive,Negative,unknown,unknown,unknown,Positive,unknown,unknown,unknown,unknown,unknown,unknown
"A couple good small plates, but everything thing seemed to be off just a little bit.",3,no majority,unknown,unknown,unknown,unknown,unknown,unknown,unknown,unknown,unknown,unknown,unknown,unknown
The restaurant is high quality but a bit pricey for the limited menu they offer but i didnt like the atmosphere of the place,no majority,no majority,Negative,unknown,unknown,unknown,Negative,unknown,unknown,unknown,unknown,unknown,unknown,unknown
As Always The Food Was GREAT!!!! But the atmosphere was NOT!!!!,3,Positive,Negative,unknown,unknown,unknown,unknown,unknown,Positive,unknown,unknown,unknown,unknown,unknown
"I'd go there again if I was staying across the street...but wouldn't drive even 5 min for it. Calamari was very good as was the desert, balance of food passable. Nice and quiet inside.",3,Positive,unknown,unknown,Positive,unknown,unknown,unknown,unknown,unknown,unknown,unknown,unknown,unknown
It could use some improvement.,3,unknown,unknown,unknown,unknown,unknown,unknown,unknown,unknown,unknown,unknown,unknown,unknown,unknown
"Wonderful food, charming atmosphere, great service, just to loud to hear anyone. A really nice place for a couple on a date.",4,Positive,Positive,Positive,Negative,unknown,unknown,unknown,unknown,unknown,unknown,unknown,unknown,unknown
I really couldn't enjoyed the food. The service was quite poor -- we waited 20 minutes to order our food after the drinks came.,2,Negative,unknown,Negative,unknown,unknown,unknown,unknown,unknown,Negative,unknown,unknown,unknown,unknown
"Bricco is great to go to on any nights but restaurant week. Could not handle the crowd. Food, service, ambiance, and quality were poor.",2,Negative,Negative,Negative,Negative,unknown,unknown,unknown,unknown,Negative,unknown,unknown,unknown,unknown
"Jake's was, as usual, up to fine dining! A good time was had by the four of us!",5,Positive,Positive,unknown,unknown,unknown,unknown,Positive,Positive,unknown,unknown,unknown,unknown,unknown
"A great, unique dining area.",no majority,unknown,Positive,unknown,unknown,unknown,unknown,Positive,unknown,unknown,unknown,unknown,unknown,unknown
"I went to the Sunday brunch. Food was amazing! They had about 10 desserts, which all looked delicious! I loved the chocolate cake!",5,Positive,unknown,unknown,unknown,unknown,unknown,unknown,Positive,unknown,unknown,unknown,unknown,unknown
The food was average - not sure what why this restaurant has been getting rave reviews,3,Negative,unknown,unknown,unknown,unknown,unknown,unknown,unknown,unknown,unknown,unknown,unknown,unknown
The food was as shabby but the decor fantastic. It all needs a facelift.,no majority,Negative,no majority,unknown,unknown,unknown,unknown,unknown,unknown,unknown,unknown,unknown,unknown,unknown
the food was OK and the service needs to improve!! They also need to do some updates on the inside!,3,no majority,Negative,Negative,unknown,unknown,unknown,unknown,unknown,unknown,unknown,unknown,unknown,unknown
"Serious rise in quality. If you are going to have a limited menu, make sure it is good. Maverick is one of our favorites.",no majority,Positive,unknown,unknown,unknown,unknown,unknown,Positive,Positive,unknown,unknown,unknown,unknown,unknown
The ambiance and service are lovely but the food is way too salty. I've been to Cesco three times in the past year and each time the food has been overly salted. I probably won't return.,no majority,Negative,Positive,Positive,unknown,unknown,unknown,unknown,unknown,unknown,unknown,unknown,unknown,unknown
"Great time, good service food was good, price was right! But it was too noisy I`d likely back again!",4,Positive,unknown,Positive,Negative,unknown,Positive,unknown,unknown,unknown,unknown,unknown,unknown,unknown
Food was very good!,no majority,Positive,unknown,unknown,unknown,unknown,unknown,unknown,unknown,unknown,unknown,unknown,unknown,unknown
"Was not a great place for Valentines day, I couldn't even hear my boyfriend's proposal!",1,unknown,unknown,unknown,Negative,unknown,unknown,unknown,unknown,unknown,Negative,unknown,unknown,unknown
"The service and warm reception and acknowledgement by all was top notch, but the ambiance was lacking. We were treated very well by every employee in the restaurant. Definately a ""go back again"" place. Food was superb.",4,Positive,Negative,Positive,unknown,unknown,unknown,unknown,unknown,unknown,unknown,unknown,unknown,unknown
"Terrible, from start to finish! Food was  cold.",1,Negative,Positive,unknown,unknown,unknown,unknown,unknown,unknown,unknown,unknown,unknown,unknown,unknown
"I went for Valentines day brunch and was suppose to get a box of really nice chocolates for my date that I never received. Service was great, though.",3,unknown,unknown,Positive,unknown,unknown,unknown,unknown,unknown,unknown,unknown,unknown,unknown,unknown
"Crazy busy. 30 minute wait with a reservation. Great service while waiting at a bar table. Very loud. Waitress slammed, but still did a good job. Food was quite good.",no majority,Positive,unknown,Negative,Negative,unknown,unknown,unknown,unknown,Negative,unknown,unknown,unknown,unknown
The restaurant seems to have had a change recently in its chef as evidenced by comparing previous pasta dishes. Still a good place for lunch or early dinner.,3,Positive,unknown,unknown,unknown,unknown,unknown,unknown,unknown,unknown,unknown,unknown,unknown,unknown
Food was not good - will definately not return!,1,Negative,unknown,unknown,unknown,unknown,unknown,unknown,unknown,unknown,unknown,unknown,unknown,unknown
"Food was poor. Very dissappointing choice as this was our 5 YEAR ANNIVERSARY. We were in a hurry to leave, but atmosphere was good, but we were starving when we left. Food also took ages to come out and the waitress was inattentive.",no majority,Negative,Positive,Negative,unknown,unknown,unknown,unknown,Negative,Negative,unknown,unknown,unknown,unknown
Great outdoor patio. Service was terrible. Made a reservation and waited 30 minutes to be seated. Nothing special.,2,unknown,no majority,Negative,unknown,unknown,unknown,unknown,unknown,Negative,Negative,unknown,unknown,unknown
Very disappointing. Had to move our table due to noise then had a substandard meal. WOn't be going back.,2,Negative,unknown,unknown,Negative,unknown,unknown,unknown,unknown,unknown,unknown,unknown,unknown,unknown
"Nice friendly staff, great mix of people. Food was outstanding.
Would recommand to all, a must try.
I'm going back as often as I can.
The bartendar was friendly and professional but it was too dark in there.",4,Positive,Negative,Positive,unknown,unknown,unknown,unknown,Positive,unknown,unknown,unknown,unknown,unknown
"Great value for delicious, filling lobster.",4,Positive,unknown,unknown,unknown,unknown,Positive,unknown,unknown,unknown,unknown,unknown,unknown,unknown
"PArty of 9. Food took over an hour to arrive, empty drinks, server didn't check on us often enough, nor keep us informed as to when food would be arrivng. My food was barly luke warm.",1,Negative,unknown,Negative,unknown,unknown,unknown,unknown,unknown,Negative,unknown,unknown,unknown,unknown
Horrible evening for Sisan's birthday,1,unknown,unknown,unknown,unknown,unknown,unknown,unknown,unknown,Negative,unknown,unknown,unknown,unknown
"The hanger steak was extremely chewy. The taste was great, just too chewy. The location perfect not to loud at all.",3,unknown,unknown,unknown,Positive,unknown,unknown,Positive,unknown,unknown,unknown,unknown,unknown,unknown
"As always...service that can be sometimes irregular, comes through in the end...yes, a true neighborhood gem...the periodic regional menus give the place a ""new menu"" feel...",4,unknown,unknown,Negative,unknown,unknown,unknown,unknown,Positive,unknown,unknown,unknown,unknown,unknown
"Typical unimaginative Italian-American fare. Everything breaded, fried or smothered with cheese and tomato sauce.  The atmosphere was warm and inviting, though!",3,Negative,Positive,unknown,unknown,unknown,unknown,unknown,Negative,unknown,Positive,unknown,unknown,unknown
The restaurant was terribly noisey and packed to the gills.,no majority,unknown,Negative,unknown,Negative,unknown,unknown,Negative,unknown,unknown,unknown,unknown,unknown,unknown
Outdated seafood choices and burnt creme brulee. Very attentive and accomodating service staff.,no majority,Negative,unknown,Positive,unknown,unknown,unknown,unknown,Negative,unknown,unknown,unknown,unknown,unknown
Great spot on the lake. But the food (brunch) was very disappointing. Expected better quality for the price!,no majority,Negative,Positive,unknown,unknown,unknown,unknown,Positive,unknown,unknown,unknown,unknown,unknown,unknown
