description,review_majority,food_aspect_majority,ambiance_aspect_majority,service_aspect_majority,noise_aspect_majority,cleanliness,price,location,menu variety,waiting time,waiting area,parking,wi-fi,kids-friendly
"we were very pleased with our experience at Rendezvous: a great selection, very good preparation, terrific dessert and friendly waitstaff made for a very enjoyable evening. we'll be back.",5,Positive,unknown,Positive,unknown,unknown,unknown,Positive,Positive,unknown,unknown,unknown,unknown,unknown
"Overpriced, bad service, substandard food, and the view is really not that great.  The live band was nice though.",2,Negative,Negative,Negative,Positive,unknown,Negative,Negative,unknown,unknown,unknown,unknown,unknown,unknown
"Horrible, tasteless food and ultra expensive. The music was great and the Dcor is ok but not enough to overcome the food. Stay away.",1,Negative,Positive,unknown,Positive,unknown,Negative,Negative,unknown,unknown,unknown,unknown,unknown,unknown
"Horribly over-priced, mediocre food (at best), but prompt service. Not to mention, blue fin tuna is on the verge of extinction and it's on their menu.",2,Negative,unknown,Positive,unknown,unknown,Negative,unknown,unknown,Positive,unknown,unknown,unknown,unknown
"Expensive. Good portions, good tasting food,  had to request for bread, waiter had to be signalled to attend to our table.",3,Positive,unknown,Negative,unknown,unknown,unknown,unknown,unknown,unknown,unknown,unknown,unknown,unknown
"We had lunch. The waiter mis-ordered two out of three meals. the food was good, not great.",3,Positive,unknown,Negative,unknown,unknown,unknown,unknown,unknown,unknown,unknown,unknown,unknown,unknown
"Our waiter was friendly, but never checked in nor came back with items that we had asked for. The staff overall were testy with one another. The food was good, but the service was poor. Noise level was very good.",3,Positive,unknown,Negative,Positive,unknown,unknown,unknown,unknown,unknown,unknown,unknown,unknown,unknown
ok for a pre-theater meal but nothing special. Service was very slow.,3,no majority,unknown,Negative,unknown,unknown,unknown,unknown,unknown,Negative,unknown,unknown,unknown,unknown
"Was expecting a fine dining experience; instead, tables under a metal roof. Would be great lunch spot, especially coming off the lake. Prices very high for a place like this and the food is tasteless.",no majority,Negative,Negative,unknown,unknown,unknown,Negative,Negative,unknown,unknown,unknown,unknown,,unknown
"Basically pleased, chef had a little attitude when I asked for my entree to be warmed it was very cold.  Too loud to have a good conversation. Thank-You.",2,no majority,unknown,Negative,Negative,unknown,unknown,unknown,unknown,unknown,unknown,unknown,unknown,unknown
The lunch portions were very small but tasty. My husband ordered the $22 seafood ristotto which consisted of maybe four bites of delicious risotto. My $14 bloody mary wasn't even good. Not impressed.,3,Positive,unknown,unknown,unknown,unknown,unknown,unknown,unknown,unknown,unknown,unknown,unknown,unknown
Chef is unable to make the simplest changes to a dish.,2,Negative,unknown,Negative,unknown,unknown,unknown,unknown,unknown,unknown,unknown,unknown,unknown,unknown
"Very expensive, loud, definetly not for a romantic evening!",1,unknown,Negative,unknown,Negative,unknown,Negative,Negative,unknown,unknown,unknown,unknown,unknown,unknown
"Nice room and good location, but unfriendly service and the menu is entirely unimpressive. Turkey club in a French restaurant? Served on what looked like wonder bread?",no majority,Negative,Positive,Negative,unknown,unknown,unknown,Positive,Negative,unknown,unknown,unknown,unknown,unknown
"Very nice looking place. Front door staff was very charming and accomodating. Server was mediocre at best. Food was okay, nothing stood out as worth the price. Very peaceful and quite atmosphere.",3,Negative,Positive,Negative,Positive,unknown,unknown,Positive,unknown,unknown,Positive,unknown,unknown,unknown
"Our watiress was great as was the food. I'm just sorry I forgot her name, but we did tip her well.",no majority,Positive,unknown,Positive,unknown,unknown,unknown,unknown,unknown,unknown,unknown,unknown,unknown,unknown
the service was rude.,1,unknown,unknown,Negative,Negative,unknown,unknown,unknown,unknown,unknown,unknown,unknown,unknown,unknown
"One of the better Theater District Choices. Nice ambiance, nice space with good fod and great service. walking distance to most theaters.",4,Positive,Positive,Positive,unknown,Positive,unknown,Positive,Positive,unknown,unknown,unknown,unknown,unknown
"were unable to go, we cancelled by phone. I hear the food is good though.",3,Positive,unknown,unknown,unknown,unknown,unknown,unknown,unknown,unknown,unknown,unknown,unknown,unknown
"Food was good. Portions of Monkfish were VERY small. But it was SO noisy, we could hardly hear each other talk. We probably will not go back there again.",2,Positive,Negative,unknown,Negative,unknown,unknown,unknown,unknown,unknown,unknown,unknown,unknown,unknown
"Usually when we go out with a group of 5 or 6 people there is at least one person whose food is not as good as the rest. Every one of our group was happy and loved their meal!  However, we could hardly have a conversation due to the loud  noise.",4,Positive,unknown,unknown,Negative,unknown,unknown,Negative,Positive,unknown,unknown,unknown,unknown,unknown
Everything was good.,5,Positive,unknown,unknown,unknown,Positive,unknown,Positive,unknown,unknown,unknown,unknown,unknown,unknown
Food was good. The noise level was very quiet. Hostess was rude and mean. Would not go back. Not even for the food.,1,Positive,unknown,Negative,Positive,unknown,unknown,unknown,unknown,unknown,unknown,unknown,unknown,unknown
"Excellent experience, I can always trust Rocca to provide a wonderful meal made with high-quality ingredients and interesting presentation. I just wish it wasn't so loud.",4,Positive,unknown,unknown,Negative,unknown,unknown,unknown,unknown,unknown,unknown,unknown,unknown,unknown
Staff was overbearing and pushed quick order and then disappeared.The food was below average in quality at best and the portions and originality were clearly too small to warrant a return visit.,no majority,Negative,unknown,Negative,unknown,unknown,unknown,unknown,unknown,unknown,unknown,unknown,unknown,unknown
"We didn't enjoy our evening out celebrating Valentine's Day early. The theater crowd had just left and the restaurant was quieter than during our last visit. The new menu was fun to explore, but inedible.",2,Negative,unknown,unknown,Positive,unknown,unknown,unknown,unknown,unknown,unknown,unknown,unknown,unknown
We were seated on a heated porch overlooking a parking lot. Ambience? My fish was served just right. My husband's veal scallopine was served with mashed potatoes. Last time for us.,no majority,Positive,Negative,unknown,unknown,unknown,unknown,unknown,unknown,unknown,unknown,unknown,unknown,unknown
the restaurant was empty and very quiet when we dined there the other evening but loved the seafood and beer.,no majority,Positive,no majority,unknown,Positive,unknown,unknown,unknown,unknown,unknown,unknown,unknown,unknown,unknown
I selected this restaurant because I thought it would be a good place for a business meeting. You met my expectations. Thanks.,4,unknown,Positive,unknown,unknown,unknown,unknown,Positive,unknown,unknown,unknown,unknown,unknown,unknown
Great location and setting but the food was great. My girlfriend and even discussed with the people at the table next to us that it was just awesome!,5,Positive,Positive,unknown,unknown,unknown,unknown,Positive,unknown,unknown,unknown,unknown,unknown,unknown
Only good if you can sit outside which we could not due to rain.,no majority,unknown,Negative,unknown,unknown,unknown,unknown,unknown,unknown,unknown,unknown,unknown,unknown,unknown
"food did not disappoint, matching the beautiful decor.",5,Positive,Positive,unknown,unknown,unknown,unknown,Positive,Positive,unknown,unknown,unknown,unknown,unknown
horrible service; will never return.,1,unknown,unknown,Negative,unknown,unknown,unknown,unknown,unknown,unknown,unknown,unknown,unknown,unknown
"Very slow service, overpriced wine ($46 for a bottle of the same wine for which I pay a little over $11 at a wine store three miles from the restaurant), and very weak coffee, but good ambiance.",2,Negative,Positive,Negative,unknown,unknown,Negative,unknown,unknown,Negative,unknown,unknown,unknown,unknown
I loved the food.d.,5,Positive,Negative,unknown,unknown,unknown,unknown,unknown,Positive,unknown,unknown,unknown,unknown,unknown
"Horrible service and bad food. Breadsticks were stale, bread was awful, spinach salad was tasteless.",1,Negative,unknown,Negative,unknown,unknown,unknown,unknown,unknown,unknown,unknown,unknown,unknown,unknown
Great neighborhood Italian restaurant!,4,unknown,unknown,unknown,unknown,unknown,unknown,Positive,Positive,unknown,unknown,unknown,unknown,unknown
"Ridiculously high concept, but with good food to pull it off. Not worth the effort (or price).",no majority,Positive,unknown,unknown,unknown,unknown,Negative,unknown,Positive,unknown,unknown,unknown,unknown,unknown
"Mother's Day Brunch - food was lousy, and waited 1 hour for after ordering, with no updates, apologies, or explanations.",1,Negative,unknown,Negative,unknown,unknown,unknown,unknown,unknown,Negative,unknown,unknown,unknown,unknown
"The Pasta Trio was great as was the wine selection. The tables are so close together. Other than the snug quarters, great! We will go back!",4,Positive,Negative,no majority,unknown,unknown,unknown,unknown,Positive,unknown,unknown,unknown,unknown,unknown
food was decent but not great.,3,Positive,unknown,unknown,unknown,unknown,unknown,unknown,unknown,unknown,unknown,unknown,unknown,unknown
Ambiance was very plain. Very limited menu. With all the hype I was more than disappointed. The food was not noteworthy - will not return.,no majority,Negative,Negative,unknown,unknown,unknown,unknown,unknown,Negative,unknown,unknown,unknown,unknown,unknown
Great food. I will definitely let everyone know about the wonderful restaurant.,5,Positive,unknown,unknown,unknown,unknown,unknown,unknown,Positive,unknown,unknown,unknown,unknown,unknown
great food and service; byob presently we will be back soon!,5,Positive,unknown,Positive,unknown,unknown,unknown,unknown,unknown,unknown,unknown,unknown,unknown,unknown
"The customer service was excellent, but the views are disappointing. The prices are very reasonable.",4,unknown,Negative,Positive,unknown,unknown,Positive,unknown,unknown,unknown,unknown,unknown,unknown,unknown
Service was non wxsiting and the food wAS POOR SEVRAL ENTREES WERE SENT BACK TO BE RECOOKED. wAITER DID NOT CARE TO COME BACK AND EVEN CHEC WITH us. Very loud. I would not go back,1,Negative,unknown,Negative,Negative,unknown,unknown,Negative,unknown,unknown,unknown,unknown,unknown,unknown
We enjoyed our excellent meal and service but i didnt really enjoy the atmosphere,no majority,Positive,Negative,Positive,unknown,unknown,unknown,unknown,Positive,unknown,unknown,unknown,unknown,unknown
The food was serviceable,3,Positive,unknown,unknown,unknown,unknown,unknown,unknown,unknown,unknown,unknown,unknown,unknown,unknown
"Just visiting Baltimore and found this restaurant via Zagat. I was traveling alone for work, great service.",4,unknown,unknown,Positive,unknown,unknown,unknown,unknown,unknown,unknown,unknown,unknown,unknown,unknown
"Average service, average food, quiet environment. If you don't have anything better...",3,Negative,Negative,no majority,Positive,unknown,unknown,unknown,unknown,unknown,unknown,unknown,unknown,unknown
"Service was excellent, food was amazing, not bad, but great.",5,Positive,unknown,Positive,unknown,unknown,unknown,unknown,unknown,unknown,unknown,unknown,unknown,unknown
Outdated dcor. Disappointing sauces on the pastas. Food was heavier than expected. Ok restaurant but nothing special.,3,Negative,Negative,unknown,unknown,unknown,unknown,unknown,unknown,unknown,unknown,unknown,unknown,unknown
Resting on its laurels- very disappointing-poor menu other than standard fare,1,Negative,unknown,unknown,unknown,unknown,unknown,unknown,Negative,unknown,unknown,unknown,unknown,unknown
food had too much sweet sauce in entree. choice was limited. will not return,1,Negative,unknown,unknown,unknown,unknown,unknown,unknown,Negative,unknown,unknown,unknown,unknown,unknown
Mediocre food with horrible service - gratuity is automatically included. Lovely atmosphere though.,2,Negative,Positive,Negative,unknown,unknown,unknown,unknown,unknown,unknown,unknown,unknown,unknown,unknown
"We were disappointed with our experience. The food was great, but the service was mediocre. My husband left a note on the back of the dining slip to that effect and our tip reflected the service.",3,Positive,unknown,Negative,unknown,unknown,unknown,unknown,unknown,unknown,unknown,unknown,unknown,unknown
"At 9 p.m. on a weeknight, we had no trouble getting a table and the food was good.",no majority,Positive,unknown,unknown,unknown,unknown,unknown,unknown,unknown,unknown,unknown,unknown,unknown,unknown
The service left something to be desired. therefore our experience was very disappointing.,no majority,unknown,unknown,Negative,unknown,unknown,unknown,unknown,unknown,unknown,unknown,unknown,unknown,unknown
"The food, as always, delicious - but the service was T E R R I B L E. Since it was my husband's birthday, and such a special occasion, we were greatly disappointed.......We did like the music and noise level though.",3,Positive,unknown,Negative,Positive,unknown,unknown,unknown,unknown,unknown,unknown,unknown,unknown,unknown
"This resturant is a delight. Food is great. This was my first visit and I am definitely going back. The service was good, very attentive and accomodating.",5,Positive,unknown,Positive,unknown,unknown,unknown,Positive,Positive,unknown,unknown,unknown,unknown,unknown
Thr service was friendly but not very attentive. The noise was low level. The food was edible but very salty and not tasty. I would not recommend it and would not go back.,2,Negative,Negative,Negative,Positive,unknown,unknown,unknown,unknown,unknown,unknown,unknown,unknown,unknown
"This is our 2nd time and the restaurant, food and service was excellent. The only bad thing is it can get too loud to have a conversation. Looking forward to going there again when I am in New Haven, CT.",4,Positive,unknown,Positive,Negative,unknown,unknown,Positive,unknown,unknown,unknown,unknown,unknown,unknown
"Excellent Caldo Mare, awesome to amazing everything else from appetizers to service.",5,no majority,unknown,Positive,unknown,unknown,unknown,unknown,Positive,unknown,unknown,unknown,unknown,unknown
Food was pricey for the quality. Not great. Service was excellent though. Better for an after-dinner dessert/drink.,3,Negative,unknown,Positive,unknown,unknown,Negative,unknown,unknown,unknown,unknown,unknown,unknown,unknown
"I think it's one of the best French restaurant in Houston, I did not notice any problems, except the very loud dining room. Staffs are all very friendly, food is served at resonable time, nice and ""hot"", defintely will return.",4,Positive,unknown,Positive,Negative,unknown,unknown,Positive,Positive,Positive,unknown,unknown,unknown,unknown
"The service was excellent, the food was good, a number of menu items were unavailable, for the cost - worth it, we will go back.",no majority,Positive,unknown,Positive,unknown,unknown,Positive,unknown,unknown,unknown,unknown,unknown,unknown,unknown
This place is as good as ever. The ravioli the artichoke appetizer satisfied all of my needs. Yay.,5,Positive,unknown,unknown,unknown,unknown,unknown,Positive,Positive,unknown,unknown,unknown,unknown,unknown
Seriously pedestrian. Not a destination dining place more of a mediocre hotel dining place. The food was ore interesting and tasty in the past.  At least the service is top-notch.,no majority,Negative,Negative,Positive,unknown,unknown,unknown,unknown,unknown,unknown,unknown,unknown,unknown,unknown
"The food was wonderful, and the service was great. We couldn't ask for a better place to go, except that it had a bad ambiance. Just looking for some place different yet reasonable, and this restaurant fit the bill!! Thank you.",4,Positive,Negative,Positive,unknown,unknown,unknown,unknown,unknown,unknown,unknown,unknown,unknown,unknown
Awful front desk girl...what a sour puss! It was so loud in there I could barely hear what the girl said.,2,unknown,unknown,Negative,Negative,unknown,unknown,unknown,unknown,unknown,unknown,unknown,unknown,unknown
"As always, we had a great night here. The atmosphere and wine were great even if the food wasn't the best. We can't wait to go back.",no majority,Negative,Positive,unknown,Positive,unknown,unknown,unknown,unknown,unknown,unknown,unknown,unknown,unknown
the food was good service unbelieveable slow I think there was one waiter even had trouble getting a bottle of wine. also very noisey and bad ambiance- food was good but two orders were not cooked as ordered.,no majority,Positive,Negative,Negative,Negative,unknown,unknown,unknown,unknown,Negative,unknown,unknown,unknown,unknown
Below average food with slow and inattentive service. A step above Olive Garden quality; nowhere near level of Westside Italians.,no majority,Negative,unknown,Negative,unknown,unknown,unknown,unknown,unknown,Negative,unknown,unknown,unknown,unknown
Cold food  food and service made for a very fun evening.,no majority,Negative,unknown,Positive,unknown,unknown,unknown,unknown,unknown,unknown,unknown,unknown,unknown,unknown
Delicious old style Italian food with lousy waiters.,3,Positive,unknown,Negative,unknown,unknown,unknown,unknown,unknown,unknown,unknown,unknown,unknown,unknown
The french toast and pan cakes seemed not to deserve its price but the atmosphere was chill and laid back,3,Negative,Positive,unknown,unknown,unknown,unknown,unknown,unknown,unknown,unknown,unknown,unknown,unknown
"Given that it was Easter Brunch the patience of the wait staff when one of our party was late was commendable.  But, the ambiance could use some help.",3,unknown,Negative,Positive,unknown,unknown,unknown,unknown,unknown,unknown,unknown,unknown,unknown,unknown
Menu is not for normal people - way too eclectic.,2,Negative,unknown,unknown,unknown,unknown,unknown,unknown,Negative,unknown,unknown,unknown,unknown,unknown
Scallops were terrible. Tasted like they had been breaded with SALT!!! At least the service was good.,2,Negative,unknown,Positive,unknown,unknown,unknown,unknown,unknown,unknown,unknown,unknown,unknown,unknown
our waitress didn't seem more interested in visiting with people at the bar than waiting on us.,1,unknown,unknown,no majority,unknown,unknown,unknown,unknown,unknown,unknown,unknown,unknown,unknown,unknown
Great kid's menu. Many items to choose from or some 1/2 size items for children as well.,4,Positive,unknown,unknown,unknown,unknown,unknown,unknown,Positive,unknown,unknown,unknown,unknown,Positive
"This is the first time I had eaten lunch at the Cafe. The food was awful, but the service was excellent.",3,Negative,unknown,Positive,unknown,unknown,unknown,unknown,unknown,unknown,unknown,unknown,unknown,unknown
Inspired food and disinterested waitstaff. Hopefully these are just growing pains.,3,Positive,unknown,Negative,unknown,unknown,unknown,unknown,Positive,unknown,unknown,unknown,unknown,unknown
"One of several trips to Harry's. The food has never been better, a steak sandwich was lunch this time. And there is a respectable wine list.",5,Positive,unknown,unknown,unknown,unknown,unknown,unknown,Positive,unknown,unknown,unknown,unknown,unknown
"server not paying attention, but friendly.",3,unknown,unknown,Negative,unknown,unknown,unknown,unknown,unknown,unknown,unknown,unknown,unknown,unknown
Wonderful meal with 88 year old mother On Mother's Day except for the bad service.,3,Positive,unknown,Negative,unknown,unknown,unknown,unknown,unknown,unknown,unknown,unknown,unknown,unknown
"Brunch was very nice, and delicious.",5,Positive,unknown,unknown,unknown,unknown,unknown,unknown,unknown,unknown,unknown,unknown,unknown,unknown
Overall pastas were very good. Appitizers needed some work. Calamari was very tough. Portions were right sizes.,3,Negative,unknown,unknown,unknown,unknown,unknown,unknown,unknown,unknown,unknown,unknown,unknown,unknown
"way too much going on with their food. too many spices, ingredients and sauces. would not recommend.",no majority,Negative,unknown,unknown,unknown,unknown,unknown,unknown,unknown,unknown,unknown,unknown,unknown,unknown
"food was quite good. off the beaten track and pretty good value
waiter didn't know how to decant wine and promptly dumped old wine (brought in) with sediment into decanter, alas.",3,Positive,unknown,Negative,unknown,unknown,Positive,unknown,unknown,unknown,unknown,unknown,unknown,unknown
My memory that this was a neighborhood restaurant that was priced moderate. It turned out to be overpriced for the quality of the food. The noise level was too loud and the service was too slow. We were disappointed.,2,Negative,unknown,Negative,Negative,unknown,Negative,unknown,unknown,Negative,unknown,unknown,unknown,unknown
Really loved it - the food was amazing and the service as attentive but not intrusive. Really great. Everyone should write down all the Top Chef Masters' names and go find their restaurants.,5,Positive,unknown,Positive,unknown,unknown,unknown,unknown,Positive,unknown,unknown,unknown,unknown,unknown
Food was good,4,Positive,no majority,unknown,unknown,unknown,unknown,unknown,unknown,unknown,unknown,unknown,unknown,unknown
"The food was exceptional but the service was poor. This is definitely not the place to go if you want a quiet, or even semi-quiet, dining experience.",3,Positive,no majority,Negative,Negative,unknown,unknown,unknown,unknown,unknown,unknown,unknown,unknown,unknown
"Very good food at very reasonable prices. If you can't get in for dinner, at least visit for lunch during a visit to the Big Easy. My only complaint is that it is usually too loud if you sit anywhere near the bar.",4,Positive,unknown,unknown,Negative,unknown,Positive,Positive,Positive,unknown,unknown,unknown,unknown,unknown
"We were seated in a separate room away from the main seating area. It seemed to be aroom for biger parties. The main room had many available seats, but our place felt cozier and relaxing..",no majority,unknown,Positive,unknown,unknown,unknown,unknown,unknown,unknown,unknown,unknown,unknown,unknown,unknown
"Okay place for families with kids. Very, very casual. Menu is limited. Waiters were nice young men but not professional. Gumbo Shop is worse in same category. We won't go back.",2,unknown,unknown,Negative,unknown,unknown,unknown,unknown,Negative,unknown,unknown,unknown,unknown,Positive
"Food was okay, thought it was a bit overpriced.",3,Negative,unknown,unknown,unknown,unknown,Negative,unknown,unknown,unknown,unknown,unknown,unknown,unknown
I enjoyed Gilmore's very much because of the service. Would recommend it to all my friends.,4,Positive,unknown,Positive,Positive,unknown,unknown,unknown,unknown,unknown,unknown,unknown,unknown,unknown
The tables were way to close in several places - we where 3 feed away from another table.,2,unknown,Negative,unknown,unknown,unknown,unknown,Negative,unknown,unknown,unknown,unknown,unknown,unknown
when food came it was good. The bill came to approximately 85 dollars but we were charged $ 460.00. Very bad experience and will not be dining here again.,1,Positive,unknown,Negative,unknown,unknown,Negative,unknown,unknown,unknown,unknown,unknown,unknown,unknown
Makes going to the opera easy! Food is incredible. Appetizers are literally (one) bite-sized.,no majority,Positive,unknown,unknown,unknown,unknown,unknown,Positive,Positive,unknown,Positive,unknown,unknown,unknown
It was freezing inside. I couldn't wait to get out of there but the food was really good!,3,Positive,Negative,Positive,unknown,unknown,unknown,Negative,unknown,unknown,Negative,unknown,unknown,unknown
"Disappointing first experience.... they were out of several entrees on the menu, and the food was less than stellar for the price. Won't be going back.",1,Negative,unknown,unknown,unknown,unknown,Negative,unknown,Negative,unknown,unknown,unknown,unknown,unknown
Food was ok. Portions small for price. Server made some comments to brighten my day. I don't think I will return.,3,Negative,unknown,Positive,unknown,unknown,Negative,unknown,unknown,unknown,unknown,unknown,unknown,unknown
Mediocre foo and a half hour wait after a reservation time would not encourage me to return. The only upside is attentive wait staff.,2,Negative,unknown,Positive,unknown,unknown,unknown,unknown,unknown,Negative,Negative,unknown,unknown,unknown
Scalini Fedelli is a fantastic restaurant. It was an unforgettable night.,5,no majority,unknown,unknown,unknown,unknown,unknown,unknown,unknown,unknown,unknown,unknown,unknown,unknown
"Not a good choice for a busy valentine's day. The staff was overmatched; the food was average at best. I expected much better, a disappointment.",no majority,Negative,unknown,Negative,unknown,unknown,unknown,unknown,unknown,Negative,unknown,unknown,unknown,unknown
The food was expensive and not that great. The portions were very small (like kid portions). I will not go back.,1,Negative,unknown,unknown,unknown,unknown,Negative,unknown,unknown,unknown,unknown,unknown,unknown,unknown
This is one of our favorite restaurants on Hilton Head Island. The food is not fantastic. My husband had the mussels and I had the lobster ravioli! Can't wait to visit again in the Fall.,no majority,Negative,unknown,unknown,unknown,unknown,unknown,unknown,unknown,unknown,unknown,unknown,unknown,unknown
