description,review_majority,food_aspect_majority,ambiance_aspect_majority,service_aspect_majority,noise_aspect_majority,cleanliness,price,location,menu variety,waiting time,waiting area,parking,wi-fi,kids-friendly
Great for midweek specials--with an amazing atmosphere,5,Positive,Positive,Positive,unknown,unknown,unknown,Positive,unknown,unknown,Positive,unknown,unknown,unknown
"What a disappointment. It took forever to get the food and my order, pizza porcini, was just horrible. The mushrooms were all but porcini, watered down and overall un-edible.",1,Negative,unknown,Negative,unknown,unknown,unknown,unknown,unknown,Negative,unknown,unknown,unknown,unknown
"The entrees were good to salvage what was otherwise a mediocre experience, at best. Service was poor, ambiance was bad, first courses uninspired, and coffee was cold. The veal shank was quite good, however.",3,Positive,Negative,Negative,unknown,unknown,unknown,unknown,unknown,unknown,unknown,unknown,unknown,unknown
A great disappointment. The food was a mish-mash of ingredients thrown together randomly and arrived at room temperature,2,Negative,unknown,unknown,unknown,unknown,unknown,unknown,unknown,unknown,unknown,unknown,unknown,unknown
Piatti's food is good...but ambiance is lacking.,3,Positive,Negative,unknown,unknown,unknown,unknown,unknown,unknown,unknown,unknown,unknown,unknown,unknown
"Walked in and seated right away, the service was some of the best we have ever had.",5,unknown,unknown,Positive,unknown,unknown,unknown,unknown,unknown,Positive,unknown,unknown,unknown,unknown
Outstanding service. I will return again. thanks.,5,unknown,unknown,Positive,unknown,unknown,unknown,Positive,unknown,unknown,unknown,unknown,unknown,unknown
"The food is usually poor but service and friendliness always a plus. Very relaxing, enjoyable, friendly place to dine. Have always enjoyed dining at Nantuckets. Especially for special occasion.",3,Negative,Positive,Positive,Positive,unknown,unknown,unknown,unknown,unknown,unknown,unknown,unknown,unknown
"Very Very Well done, as Always , Great Food , Great Service...............Thanks

Larry A. Dawley
Pres.
Dawley Aviation Corp
Burlington Wi. 53105",5,Positive,unknown,Positive,unknown,unknown,unknown,Positive,Positive,unknown,unknown,unknown,unknown,unknown
"My boyfriend and I loved the modern, quiet ambiance and the impeccable service. We had an amazing table, even though we only reserved the table one week before we went.",5,unknown,Positive,Positive,Positive,unknown,unknown,unknown,unknown,Positive,unknown,unknown,unknown,unknown
Food very inconsistent. Not a very fun vibe,1,Negative,Negative,unknown,unknown,unknown,unknown,unknown,unknown,unknown,unknown,unknown,unknown,unknown
the ambiance complemented the good comments about food & service. I had no headache when I left.,4,Positive,Positive,Positive,Negative,unknown,unknown,Positive,unknown,unknown,Positive,unknown,unknown,unknown
"EXCELLENT FOOD / EXCELLENT SERVICE!! Atmosphere was great, loved the view. Will be back!",5,Positive,Positive,Positive,unknown,unknown,unknown,Positive,unknown,unknown,unknown,unknown,unknown,unknown
"Excellent in all aspects except ambiance, I would highly recommend to friends and family who aren't concerned with ambiance.",4,Positive,Negative,Positive,Positive,Positive,unknown,Positive,Positive,unknown,unknown,unknown,unknown,unknown
"Our service could not have been worse. Food was overpriced. The menu not very interesting. I wanted this place to be good because the space is so interesting, but it was pretty bad.",1,Negative,unknown,Negative,unknown,unknown,Negative,unknown,Negative,unknown,unknown,unknown,unknown,unknown
Rush rush rush turn over the tables rude service people but not heavy oily food. Not as good as I expected.,2,no majority,unknown,Negative,unknown,unknown,unknown,unknown,unknown,Negative,unknown,unknown,unknown,unknown
"I had two casual dinners at State & Lake and three lunches. The food and the service were always great. Everything was delicious. The interior is questionable, but not intrusive. Very quiet, excellent spot for romantic dinner.",4,Positive,Negative,Positive,Positive,unknown,unknown,Positive,unknown,unknown,unknown,unknown,unknown,unknown
"Was thrilled be new menu, we enjoyed the previous menu selections as well. Service was slow,we were there for a pre show dinner, we arrived 2 hours prior and did not have time for dessert.",3,Positive,unknown,Negative,unknown,unknown,unknown,unknown,Positive,Negative,unknown,unknown,unknown,unknown
Boring place. We were not surprised with how bad the food was. I would never go back.,1,Negative,unknown,unknown,unknown,unknown,unknown,unknown,unknown,unknown,unknown,unknown,unknown,unknown
Incredibly overpriced. I'd never go back.,1,unknown,unknown,unknown,unknown,unknown,Negative,unknown,unknown,unknown,unknown,unknown,unknown,unknown
"Food was a disappointment, duck confit parpadelle was so greasy it was closer to diner food. Shame, not to the standards of most South End restaurants. The ambiance was nice and the tables weren't too close together",3,Negative,Positive,unknown,unknown,unknown,unknown,unknown,unknown,unknown,unknown,unknown,unknown,unknown
"We were there for brunch.  It had a nice quiet atmosphere. Waitress gave me regular coffee when I requested decaf. Did not bring jam/peanut butter with our toast, and did not check back to our table.",3,unknown,unknown,Negative,Positive,unknown,unknown,unknown,unknown,unknown,unknown,unknown,unknown,unknown
The portion of the meals were small. Left unsatisfied and still hungery.  Disapointed in the menue.,no majority,Negative,unknown,unknown,unknown,unknown,unknown,unknown,unknown,unknown,unknown,unknown,unknown,unknown
"Love everything about The Library Bistro! Bad service, but wonderful food, and the best Bloody Marys! Plus they gave all Moms a lovely tulip (from the Market I am presuming) which was a nice touch.",4,Positive,unknown,Negative,unknown,unknown,unknown,unknown,Positive,Negative,unknown,unknown,unknown,unknown
"All was not top notch this will be our special occasion restaurant,matter of fact it is so good I may make up some special occasions but service could improve.",4,Positive,unknown,Negative,unknown,unknown,unknown,unknown,unknown,unknown,unknown,unknown,unknown,unknown
Very limited menu. Weird food. Comfortable seating and atmosphere. I would definitely not go back. Disappointing for a Marc Vetri restaurant.,no majority,Negative,Positive,unknown,unknown,unknown,unknown,unknown,Negative,unknown,unknown,unknown,unknown,unknown
For the price the food was only fair and the service was bad. There are many restaurants that are the same money or cheaper that are better,no majority,Positive,unknown,Negative,unknown,unknown,Negative,unknown,unknown,unknown,unknown,unknown,unknown,unknown
touristy but the ambiance was lovely- not a neighborhood spot at all,no majority,unknown,Positive,unknown,unknown,unknown,unknown,unknown,unknown,unknown,unknown,unknown,unknown,unknown
"Stuffed shells and the crab cakes were delicious. staff was rude, filet was cooked to perfection. Very tasty food. Nice view of the Potomac.",4,Positive,Positive,unknown,unknown,unknown,unknown,Positive,unknown,unknown,unknown,unknown,unknown,unknown
good service. Extremely loud and hard to hear.,3,unknown,unknown,Positive,Negative,unknown,unknown,unknown,unknown,unknown,unknown,unknown,unknown,unknown
I can't say enough about the food and the service. My husband and I will be back.,5,Positive,unknown,Positive,unknown,unknown,unknown,unknown,unknown,unknown,unknown,unknown,unknown,unknown
ok neighborhood restaurant nothing special,3,unknown,unknown,unknown,unknown,unknown,unknown,unknown,unknown,unknown,unknown,unknown,unknown,unknown
They have some issues with food and service that they need to work out.,2,Negative,unknown,Negative,unknown,unknown,unknown,unknown,unknown,unknown,unknown,unknown,unknown,unknown
The food was not good. The staff was friendly and helpful but the food was really very average. The lighting was too harsh.,3,Negative,Negative,Positive,unknown,unknown,unknown,unknown,unknown,unknown,unknown,unknown,unknown,unknown
No a la carte menu. Had to argue to get onion soup from one pri-fixe menu and coquilles from another. Portions were NOT huge and the food was just average.,3,Negative,unknown,Negative,unknown,unknown,unknown,unknown,Negative,unknown,unknown,unknown,unknown,unknown
"The food was delicious, and the serving size was very large...I did not leave hungry. But it was not worth the price.",3,Positive,unknown,unknown,unknown,unknown,Negative,unknown,unknown,unknown,unknown,unknown,unknown,unknown
Appetizers were pricey and quantity was quite small. Shrimp appetizer $15.50 and only 3 large not jumbo shrimp on the plate. The entrees were filling. Ambiance was pleasant.,no majority,Negative,Positive,unknown,unknown,unknown,unknown,unknown,unknown,unknown,unknown,unknown,unknown,unknown
"french onion soup was great; frisee salad was very average to fair...like someone dumped frisee on the plate and threw and egg and some bacon on top. Service was great, but not much there otherwise....",no majority,Negative,unknown,Positive,unknown,unknown,unknown,unknown,unknown,unknown,unknown,unknown,unknown,unknown
Advertise as having nice sounds. It's true!,4,unknown,Negative,unknown,Positive,unknown,unknown,unknown,unknown,unknown,Positive,unknown,unknown,unknown
"The meal was not as good as we had hoped. The waiter was less than professional. A little too casual, we thought.",2,Negative,Negative,Negative,unknown,unknown,unknown,unknown,unknown,unknown,unknown,unknown,unknown,unknown
Food came out luke warm but it was good overall.,3,Positive,unknown,unknown,unknown,unknown,unknown,unknown,unknown,unknown,unknown,unknown,unknown,unknown
I was disappointed. I expected better service.,no majority,unknown,unknown,Negative,unknown,unknown,unknown,unknown,unknown,unknown,unknown,unknown,unknown,unknown
3 of 4 entrees were cold(2 steak salads and a alfredo dish). Had to ask 3x for an iced-tea.,1,Negative,unknown,Negative,unknown,unknown,unknown,unknown,unknown,unknown,unknown,unknown,unknown,unknown
Been going to Kuleto's for years.,5,unknown,unknown,unknown,unknown,Positive,unknown,Positive,Positive,Positive,Positive,unknown,unknown,unknown
Kitschy and touristy. A bit pricey for the quality. This place definitely gets by on its claim as the best restaurant in the US.,3,no majority,no majority,unknown,unknown,unknown,Negative,unknown,unknown,unknown,unknown,unknown,unknown,unknown
"COULD HAVE BEEN MUCH BETTER.
FOOD WAS COLD...SENT BACK AND NEW WARM FOOD ARRIVED",2,Negative,unknown,unknown,unknown,unknown,unknown,unknown,unknown,unknown,unknown,unknown,unknown,unknown
"The food was probably as good as you get in the Dells...no bad. the decor, however, left me wondering when Starsky and Hutch were going to show up for a drink.",3,Positive,Negative,unknown,unknown,unknown,unknown,unknown,unknown,unknown,unknown,unknown,unknown,unknown
nice restaurant. portions leave you hungry. beautiful views,3,Negative,Positive,unknown,unknown,unknown,unknown,Positive,unknown,unknown,unknown,unknown,unknown,unknown
Service was good but a little slow. I felt it was priced too high for the quality of the food.,3,Negative,unknown,Positive,unknown,unknown,Negative,unknown,unknown,unknown,unknown,unknown,unknown,unknown
A little training for the wait staff re wine service would be a benefit to the restaurant...then again maybe our expectations were a bit high. The food was good.,3,Positive,unknown,Negative,unknown,unknown,unknown,unknown,unknown,unknown,unknown,unknown,unknown,unknown
Not in keeping with the elegant and high quality level of the Arizona Biltmore. I would not recommend it at all.,2,unknown,Positive,unknown,unknown,unknown,unknown,unknown,Negative,unknown,unknown,unknown,unknown,unknown
"Good apps, decent dinner, and lacking wrt dessert. Service was on the ball. Best part was the view. Probably won't return all things considered.",3,Positive,Positive,Positive,unknown,unknown,unknown,Positive,unknown,unknown,unknown,unknown,unknown,unknown
"The food was ban and burned  but not fabulous. So, so.

WOuld not return.",1,Negative,unknown,unknown,unknown,unknown,unknown,unknown,unknown,unknown,unknown,unknown,unknown,unknown
The service was PAINFULLY slow. the poor service (or lack of service) tarnished the entire lunch.,1,unknown,unknown,Negative,unknown,unknown,unknown,unknown,unknown,Negative,unknown,unknown,unknown,unknown
Food was slightly warmer than cold.,2,Negative,unknown,unknown,unknown,unknown,unknown,unknown,unknown,unknown,unknown,unknown,unknown,unknown
Was expecting more based on what I had heard about it and I was not disappointed. To me it was great. The food was delicious!,no majority,Positive,unknown,unknown,unknown,unknown,unknown,unknown,unknown,unknown,unknown,unknown,unknown,unknown
"the service, excellent and the vibe, relaxed. We were plesantly surprised with the live guitar of jazzy pop that accompanied our meal.",5,unknown,Positive,Positive,Positive,unknown,unknown,unknown,unknown,unknown,unknown,unknown,unknown,unknown
"We celebrated our 10 Anniversary in the ""Sinatra"" booth. It was a great dinner at a very relaxed pace, which means the service was slow. We are planning on making our yearly anniversary dinner spot. This place just oozes history.",no majority,Positive,unknown,Negative,unknown,unknown,unknown,Positive,unknown,unknown,unknown,unknown,unknown,unknown
Not worth a return trip. Very dated.,1,unknown,Negative,unknown,unknown,unknown,unknown,Negative,unknown,unknown,Negative,unknown,unknown,unknown
"The atmosphere was very nice...But have gone to many Champagne Brunches for the same cash. the food was O.K. not what i expected.
Gilbert Chouinard",3,Negative,Positive,unknown,unknown,unknown,unknown,unknown,unknown,unknown,Positive,unknown,unknown,unknown
Our server was fabulous. I LOVE THE PUBLICAN!!,5,unknown,unknown,Positive,unknown,unknown,unknown,Positive,unknown,unknown,unknown,unknown,unknown,unknown
Very accommodating. The price fixe appetizer and entree were excellent. The dessert chocolate almond tarte was not tasteful at all. Stay with the savory items at this place.,no majority,Positive,unknown,unknown,unknown,unknown,unknown,unknown,unknown,unknown,unknown,unknown,unknown,unknown
too loud to have a conversation,2,unknown,unknown,unknown,Negative,unknown,unknown,unknown,unknown,unknown,Negative,unknown,unknown,unknown
Ordered roast leg of lamb and extremely tough. This shouldn't be coming out of the kitchen. You either need to find a new purveyor for lamb or someone who knows how to roast it. Our waiter was supposed to bring us our check but took forever.,1,Negative,unknown,Negative,unknown,unknown,unknown,unknown,unknown,unknown,unknown,unknown,unknown,unknown
The menu was limited with nothing of exception. The Bistro salad was quite good. The mushroom ravioli were too oily and not up to expectations. It was way too loud and made conversation impossible.,3,Negative,unknown,unknown,Negative,unknown,unknown,unknown,Negative,unknown,unknown,unknown,unknown,unknown
Sat nite food was not well prepared. Too crowded and loud.,2,Negative,Negative,unknown,Negative,unknown,unknown,unknown,unknown,unknown,unknown,unknown,unknown,unknown
Too loud! Too crowded! But the food had great flavor. Will never go back,2,Positive,Negative,unknown,Negative,unknown,unknown,Negative,unknown,unknown,Negative,unknown,unknown,unknown
"The Burlingame restaurant is not as attractive or quiet as the ones in Corte Madera or Sacramento. The food is just the same, but the overall experience is less satisfying. Add to that not great service.",3,Negative,Negative,Negative,Negative,unknown,unknown,Negative,unknown,unknown,unknown,unknown,unknown,unknown
"The place itself is very nice, the food is expensive, which by itself is fine.",4,Positive,Positive,unknown,unknown,unknown,unknown,Positive,unknown,unknown,unknown,unknown,unknown,unknown
"Lovely in every way. My halibut came out pretty cold though-my only gripe, but the very attentive and professional service more than made up for it.",4,Negative,unknown,Positive,unknown,unknown,unknown,unknown,unknown,unknown,unknown,unknown,unknown,unknown
$125.00 for a great meal that was not rushed through.,4,Positive,unknown,Negative,unknown,unknown,Positive,unknown,unknown,unknown,unknown,unknown,unknown,unknown
"Disappointing ambiance: incredibly cheesy, cliched Valentine's day experience.

Food was OK but nothing spectacular.",no majority,Negative,Negative,unknown,unknown,unknown,unknown,unknown,unknown,unknown,Negative,unknown,unknown,unknown
Veal parm was okay; spinach and cheese raviolis doughy and sauce too sweet and pasty. Fish was oily. Service - good. Left more than a 15% tip. Food took no time to get to the table.,3,Negative,unknown,Positive,unknown,unknown,unknown,unknown,unknown,Positive,unknown,unknown,unknown,unknown
Food was good,4,Positive,unknown,unknown,unknown,unknown,unknown,unknown,unknown,unknown,unknown,unknown,unknown,unknown
"Usually great food. This time, mediocre.",3,Negative,unknown,unknown,unknown,unknown,unknown,unknown,unknown,unknown,unknown,unknown,unknown,unknown
"Great food, service and atmosphere, other than the loud dining room. Scallop dish was outstanding as was the apple dessert and caesar salad. We were first timers that will be back with friends.",4,Positive,Positive,Positive,Negative,unknown,unknown,Positive,unknown,unknown,unknown,unknown,unknown,unknown
"Scones at brunch were incredible, and the dining room was so comfortable.",5,Positive,Positive,unknown,unknown,unknown,unknown,unknown,unknown,unknown,unknown,unknown,unknown,unknown
"Food was mediocre and really expensive. Swiss chard as the vegetable on every special. Steak was tough, lamb was chewy, not worth the price and really unimaginative.  The service was great however.",2,Negative,unknown,Positive,unknown,unknown,Negative,unknown,Negative,unknown,unknown,unknown,unknown,unknown
Food was good.. not wonderful. Service was top notch.,4,Positive,unknown,Positive,unknown,unknown,unknown,unknown,unknown,unknown,unknown,unknown,unknown,unknown
Mediocre overpriced food.,1,Negative,unknown,unknown,Negative,unknown,Negative,unknown,unknown,unknown,unknown,unknown,unknown,unknown
"Service was good, but the food was not good at all. I would never go back.",2,Negative,unknown,Positive,unknown,unknown,unknown,unknown,unknown,unknown,unknown,unknown,unknown,unknown
Will never waste my money there again...,1,unknown,unknown,unknown,unknown,unknown,Negative,unknown,unknown,Negative,unknown,unknown,unknown,unknown
Such a great setting and service - menu has something for everyone and prices are great. Happy hour also has a lot to offer.,5,Positive,unknown,Positive,unknown,unknown,Positive,Positive,Positive,unknown,unknown,unknown,unknown,unknown
"Went for Mothers Day Brunch. Food was great, waitstaff did not know the menu though. Great views.",3,Positive,Positive,Negative,unknown,unknown,unknown,Positive,unknown,unknown,unknown,unknown,unknown,unknown
Big approval. The salmon is usually a simple dish to make. I have never had better results at Chilis.,no majority,Positive,unknown,unknown,unknown,unknown,unknown,unknown,unknown,unknown,unknown,unknown,unknown,unknown
Don't waste your money. It used to have interesting food. Very low end and pricey.,no majority,Negative,Negative,unknown,unknown,unknown,Negative,unknown,Negative,unknown,unknown,unknown,unknown,unknown
"We had one drink each which cost more than our entrees. there was too much noise. There aren't any prices on the drink menu, it's highway robbery! Thank God we didn't order two cocktails like we usually do.",2,unknown,unknown,unknown,Negative,unknown,Negative,unknown,unknown,unknown,unknown,unknown,unknown,unknown
"Good atmosphere, Food was cold and undercooked very innovative.
The desserts I didn't find them so spectacular",no majority,Negative,Positive,unknown,unknown,unknown,unknown,unknown,unknown,unknown,Positive,unknown,unknown,unknown
We were in a big group and were sat outside in a tent--I'm sure due to high volume of Valentine's weekend. Food was good.,4,Positive,unknown,unknown,unknown,unknown,unknown,unknown,unknown,unknown,unknown,unknown,unknown,unknown
Very bad food and service!!! Also they charged 20% service whe most restaurants charge 18% and they didn't deserve it!!!! Especially since they have bad ambiance!!!,1,Negative,Negative,Negative,unknown,unknown,unknown,unknown,unknown,unknown,unknown,unknown,unknown,unknown
Nothing special..like a Bennigan's. The 15 yr old chose this.,3,Negative,unknown,unknown,unknown,unknown,unknown,unknown,unknown,unknown,unknown,unknown,unknown,Positive
"Everyone was very attentive. We ate the 12 course meal, which took too long. I think we were all ready to leave by the 8th or 9th course.",3,unknown,unknown,Positive,unknown,unknown,unknown,unknown,Positive,Negative,unknown,unknown,unknown,unknown
Great setting and crowd. Service was very disappointing. Not worth the high prices.,3,unknown,Positive,Negative,Positive,unknown,Negative,Positive,unknown,unknown,unknown,unknown,unknown,unknown
"I was really excited to try this place, and the food was just amazing. The service was not great- our waiter barely said 2 words to us. The place was empty and very quiet though.",3,Positive,unknown,Negative,Positive,unknown,unknown,unknown,unknown,unknown,unknown,unknown,unknown,unknown
The food was fair. I didn't think it was worth the price. The room was very quiet which was great for a romantic dinner.,3,Negative,unknown,unknown,Positive,unknown,Negative,unknown,unknown,unknown,unknown,unknown,unknown,unknown
knowing upfront they don't take any plastic other than amex and lack a liquor license would be a real treat for the next guest.,2,unknown,unknown,Negative,unknown,unknown,unknown,unknown,unknown,unknown,unknown,unknown,unknown,unknown
THE FOOD WAS BELOW PAR. MY FISHERMAN'S PLATTER LOOKED LIKE MOUND OF OF BREADING AND WAS VERY GREASY. THE TASTE WAS AWFUL. THE FLOUNDER THAT MY SON ORDERED WAS LITERALLY DROWNED IN BUTTER. THE SERVICE WAS GOOD THOUGH.,2,Negative,no majority,Positive,unknown,unknown,unknown,unknown,unknown,unknown,unknown,unknown,unknown,unknown
"Tables were small - unable to accomodate mulitple items at the same time
An outdoor movie screen add nothing to the dining experience",1,unknown,Negative,unknown,unknown,unknown,unknown,unknown,unknown,unknown,unknown,unknown,unknown,unknown
They were well staffed the night we dined there. The timing of dessert was  good. The chocolate souffle was VERY overcooked.....inedible. Just nice to dine here to make going to a performance easy.,no majority,Negative,unknown,Positive,unknown,unknown,unknown,Positive,unknown,Positive,unknown,unknown,unknown,unknown
I was not impressed with the flavor of the food.,2,Negative,Negative,unknown,unknown,unknown,unknown,unknown,unknown,unknown,unknown,unknown,unknown,unknown
Outstanding service - 3rd trip to this restaurant.,5,unknown,unknown,Positive,unknown,Positive,unknown,Positive,unknown,Positive,unknown,unknown,unknown,Positive
This is a super place to celebrate a birthday! Unfortunately it always sounds like a birthday party inside.,no majority,unknown,unknown,unknown,Negative,unknown,unknown,Positive,unknown,unknown,unknown,unknown,unknown,unknown
Food was extremely salty. Tasted unremarkable. Disappointed.,1,Negative,unknown,unknown,unknown,unknown,unknown,unknown,unknown,unknown,unknown,unknown,unknown,unknown
I went here starving and had a great appetizer. They were served hot and fresh. I would return here to eat and drink on the patio.,5,Positive,unknown,unknown,unknown,unknown,unknown,unknown,unknown,unknown,unknown,unknown,unknown,unknown
Our food was horrible and the service was good. The prices are high and the portions are small. Probably won't go again.,2,Negative,unknown,Positive,unknown,unknown,Negative,unknown,unknown,unknown,unknown,unknown,unknown,unknown
The menu was limited but the food was good. Service was efficient and friendly. I did not feel very welcome.,3,Positive,unknown,Positive,unknown,unknown,unknown,unknown,Negative,unknown,unknown,unknown,unknown,unknown
Minute-sized portions and an extraordinarily slow kitchen made for a less-than-ideal experience. Also I did not enjoy the ambiance.,no majority,Negative,Negative,Negative,unknown,unknown,unknown,unknown,unknown,Negative,unknown,unknown,unknown,unknown
Great food...had the sea bass and veal. So delicious and prepared at the table.,4,Positive,unknown,unknown,unknown,unknown,unknown,unknown,unknown,unknown,unknown,unknown,unknown,unknown
"Nothing special. In fact, breakfast buffet was a major ripoff ... $82 for two people, no drinks! Staff was friendly",no majority,Negative,unknown,Positive,unknown,unknown,Negative,unknown,unknown,unknown,unknown,unknown,unknown,unknown
It was great.,4,unknown,unknown,unknown,unknown,Positive,unknown,Positive,unknown,unknown,Positive,unknown,Positive,Positive
Food was cold.....oh and they got rid of their yummy eggs benny and replaced them with some sauced thing..,2,Negative,unknown,Negative,unknown,unknown,unknown,unknown,unknown,unknown,unknown,unknown,unknown,unknown
"What a disappointment! The Left Bank used to be this a marvelous, vibrant restaurant. In the past, the service was excellent, the food very good. Not so anymore.",2,Negative,unknown,Negative,unknown,unknown,unknown,unknown,unknown,unknown,unknown,unknown,unknown,unknown
"A very tired Boston institution. Abundance of wait staff, but the number of captains, watching you wait was nice. Loved it 30 years ago, but it's old and tired. Definitely not worth the price.",no majority,unknown,Negative,no majority,unknown,unknown,Negative,unknown,unknown,unknown,Negative,unknown,unknown,unknown
